smartctl 7.0 2018-12-30 r4883 [x86_64-linux-3.10.0-1062.18.1.el7.x86_64] (local build)
Copyright (C) 2002-18, Bruce Allen, Christian Franke, www.smartmontools.org

=== START OF INFORMATION SECTION ===
Model Family:     Western Digital Green
Device Model:     WDC WD20EARX-00PASB0
Serial Number:    WD-WLINUXFABRIK
LU WWN Device Id: 5 0014ee 0ad754ec7
Firmware Version: 51.0AB51
User Capacity:    2'000'398'934'016 bytes [2.00 TB]
Sector Sizes:     512 bytes logical, 4096 bytes physical
Device is:        In smartctl database [for details use: -P show]
ATA Version is:   ATA8-ACS (minor revision not indicated)
SATA Version is:  SATA 3.0, 6.0 Gb/s (current: 6.0 Gb/s)
Local Time is:    Tue May  5 10:54:55 2020 CEST
SMART support is: Available - device has SMART capability.
SMART support is: Enabled
AAM feature is:   Unavailable
APM feature is:   Unavailable
Rd look-ahead is: Enabled
Write cache is:   Enabled
DSN feature is:   Unavailable
ATA Security is:  Disabled, frozen [SEC2]
Wt Cache Reorder: Enabled

=== START OF READ SMART DATA SECTION ===
SMART overall-health self-assessment test result: PASSED

General SMART Values:
Offline data collection status:  (0x82)	Offline data collection activity
					was completed without error.
					Auto Offline Data Collection: Enabled.
Self-test execution status:      (   0)	The previous self-test routine completed
					without error or no self-test has ever 
					been run.
Total time to complete Offline 
data collection: 		(37800) seconds.
Offline data collection
capabilities: 			 (0x7b) SMART execute Offline immediate.
					Auto Offline data collection on/off support.
					Suspend Offline collection upon new
					command.
					Offline surface scan supported.
					Self-test supported.
					Conveyance Self-test supported.
					Selective Self-test supported.
SMART capabilities:            (0x0003)	Saves SMART data before entering
					power-saving mode.
					Supports SMART auto save timer.
Error logging capability:        (0x01)	Error logging supported.
					General Purpose Logging supported.
Short self-test routine 
recommended polling time: 	 (   2) minutes.
Extended self-test routine
recommended polling time: 	 ( 364) minutes.
Conveyance self-test routine
recommended polling time: 	 (   5) minutes.
SCT capabilities: 	       (0x3035)	SCT Status supported.
					SCT Feature Control supported.
					SCT Data Table supported.

SMART Attributes Data Structure revision number: 16
Vendor Specific SMART Attributes with Thresholds:
ID# ATTRIBUTE_NAME          FLAGS    VALUE WORST THRESH FAIL RAW_VALUE
  1 Raw_Read_Error_Rate     POSR-K   200   200   051    -    0
  3 Spin_Up_Time            POS--K   169   162   021    -    6525
  4 Start_Stop_Count        -O--CK   097   097   000    -    3432
  5 Reallocated_Sector_Ct   PO--CK   200   200   140    -    0
  7 Seek_Error_Rate         -OSR-K   200   200   000    -    0
  9 Power_On_Hours          -O--CK   067   067   000    -    24335
 10 Spin_Retry_Count        -O--CK   100   100   000    -    0
 11 Calibration_Retry_Count -O--CK   100   100   000    -    0
 12 Power_Cycle_Count       -O--CK   098   098   000    -    2301
192 Power-Off_Retract_Count -O--CK   200   200   000    -    117
193 Load_Cycle_Count        -O--CK   175   175   000    -    75000
194 Temperature_Celsius     -O---K   113   100   000    -    37
196 Reallocated_Event_Count -O--CK   200   200   000    -    0
197 Current_Pending_Sector  -O--CK   200   200   000    -    0
198 Offline_Uncorrectable   ----CK   200   200   000    -    0
199 UDMA_CRC_Error_Count    -O--CK   200   200   000    -    0
200 Multi_Zone_Error_Rate   ---R--   200   200   000    -    13
                            ||||||_ K auto-keep
                            |||||__ C event count
                            ||||___ R error rate
                            |||____ S speed/performance
                            ||_____ O updated online
                            |______ P prefailure warning

General Purpose Log Directory Version 1
SMART           Log Directory Version 1 [multi-sector log support]
Address    Access  R/W   Size  Description
0x00       GPL,SL  R/O      1  Log Directory
0x01           SL  R/O      1  Summary SMART error log
0x02           SL  R/O      5  Comprehensive SMART error log
0x03       GPL     R/O      6  Ext. Comprehensive SMART error log
0x06           SL  R/O      1  SMART self-test log
0x07       GPL     R/O      1  Extended self-test log
0x09           SL  R/W      1  Selective self-test log
0x10       GPL     R/O      1  NCQ Command Error log
0x11       GPL     R/O      1  SATA Phy Event Counters log
0x80-0x9f  GPL,SL  R/W     16  Host vendor specific log
0xa0-0xa7  GPL,SL  VS      16  Device vendor specific log
0xa8-0xb7  GPL,SL  VS       1  Device vendor specific log
0xc0       GPL,SL  VS       1  Device vendor specific log
0xc1       GPL     VS      93  Device vendor specific log
0xe0       GPL,SL  R/W      1  SCT Command/Status
0xe1       GPL,SL  R/W      1  SCT Data Transfer

SMART Extended Comprehensive Error Log Version: 1 (6 sectors)
Device Error Count: 2
	CR     = Command Register
	FEATR  = Features Register
	COUNT  = Count (was: Sector Count) Register
	LBA_48 = Upper bytes of LBA High/Mid/Low Registers ]  ATA-8
	LH     = LBA High (was: Cylinder High) Register    ]   LBA
	LM     = LBA Mid (was: Cylinder Low) Register      ] Register
	LL     = LBA Low (was: Sector Number) Register     ]
	DV     = Device (was: Device/Head) Register
	DC     = Device Control Register
	ER     = Error register
	ST     = Status register
Powered_Up_Time is measured from power on, and printed as
DDd+hh:mm:SS.sss where DD=days, hh=hours, mm=minutes,
SS=sec, and sss=millisec. It "wraps" after 49.710 days.

Error 2 [1] occurred at disk power-on lifetime: 2301 hours (95 days + 21 hours)
  When the command that caused the error occurred, the device was doing SMART Offline or Self-test.

  After command completion occurred, registers were:
  ER -- ST COUNT  LBA_48  LH LM LL DV DC
  -- -- -- == -- == == == -- -- -- -- --
  04 -- 51 00 01 00 00 00 00 00 00 a0 00  Error: ABRT

  Commands leading to the command that caused the error were:
  CR FEATR COUNT  LBA_48  LH LM LL DV DC  Powered_Up_Time  Command/Feature_Name
  -- == -- == -- == == == -- -- -- -- --  ---------------  --------------------
  b0 00 d6 00 01 00 00 00 c2 4f e0 a0 00     00:40:04.958  SMART WRITE LOG
  b0 00 d5 00 01 00 00 00 c2 4f e0 a0 00     00:38:22.705  SMART READ LOG
  b0 00 d5 00 01 00 00 00 c2 4f e0 a0 00     00:38:21.706  SMART READ LOG
  b0 00 d5 00 01 00 00 00 c2 4f e0 a0 00     00:38:20.702  SMART READ LOG
  b0 00 d5 00 01 00 00 00 c2 4f e0 a0 00     00:38:19.703  SMART READ LOG

Error 1 [0] occurred at disk power-on lifetime: 2301 hours (95 days + 21 hours)
  When the command that caused the error occurred, the device was active or idle.

  After command completion occurred, registers were:
  ER -- ST COUNT  LBA_48  LH LM LL DV DC
  -- -- -- == -- == == == -- -- -- -- --
  04 -- 51 00 01 00 00 00 00 00 00 a0 00  Error: ABRT

  Commands leading to the command that caused the error were:
  CR FEATR COUNT  LBA_48  LH LM LL DV DC  Powered_Up_Time  Command/Feature_Name
  -- == -- == -- == == == -- -- -- -- --  ---------------  --------------------
  b0 00 d6 00 01 00 00 00 c2 4f e0 a0 00     00:38:14.696  SMART WRITE LOG
  60 00 10 00 70 00 00 00 00 00 00 40 00     00:38:14.211  READ FPDMA QUEUED
  60 00 50 00 68 00 00 12 1c 96 e4 40 00     00:33:58.087  READ FPDMA QUEUED
  60 00 08 00 60 00 00 12 1c 97 04 40 00     00:33:58.052  READ FPDMA QUEUED
  60 00 08 00 58 00 00 07 58 0a 74 40 00     00:33:51.050  READ FPDMA QUEUED

SMART Extended Self-test Log Version: 1 (1 sectors)
Num  Test_Description    Status                  Remaining  LifeTime(hours)  LBA_of_first_error
# 1  Short offline       Interrupted (host reset)      10%      4174         -

SMART Selective self-test log data structure revision number 1
 SPAN  MIN_LBA  MAX_LBA  CURRENT_TEST_STATUS
    1        0        0  Not_testing
    2        0        0  Not_testing
    3        0        0  Not_testing
    4        0        0  Not_testing
    5        0        0  Not_testing
Selective self-test flags (0x0):
  After scanning selected spans, do NOT read-scan remainder of disk.
If Selective self-test is pending on power-up, resume after 0 minute delay.

SCT Status Version:                  3
SCT Version (vendor specific):       258 (0x0102)
Device State:                        Active (0)
Current Temperature:                    36 Celsius
Power Cycle Min/Max Temperature:     27/39 Celsius
Lifetime    Min/Max Temperature:     27/50 Celsius
Under/Over Temperature Limit Count:   0/0

SCT Temperature History Version:     2
Temperature Sampling Period:         1 minute
Temperature Logging Interval:        1 minute
Min/Max recommended Temperature:      0/60 Celsius
Min/Max Temperature Limit:           -41/85 Celsius
Temperature History Size (Index):    478 (294)

Index    Estimated Time   Temperature Celsius
 295    2020-05-05 02:57    36  *****************
 ...    ..( 14 skipped).    ..  *****************
 310    2020-05-05 03:12    36  *****************
 311    2020-05-05 03:13    37  ******************
 312    2020-05-05 03:14    37  ******************
 313    2020-05-05 03:15    37  ******************
 314    2020-05-05 03:16    36  *****************
 ...    ..(  3 skipped).    ..  *****************
 318    2020-05-05 03:20    36  *****************
 319    2020-05-05 03:21    37  ******************
 320    2020-05-05 03:22    36  *****************
 ...    ..(  6 skipped).    ..  *****************
 327    2020-05-05 03:29    36  *****************
 328    2020-05-05 03:30    37  ******************
 329    2020-05-05 03:31    37  ******************
 330    2020-05-05 03:32    37  ******************
 331    2020-05-05 03:33    36  *****************
 ...    ..(  4 skipped).    ..  *****************
 336    2020-05-05 03:38    36  *****************
 337    2020-05-05 03:39    37  ******************
 338    2020-05-05 03:40    37  ******************
 339    2020-05-05 03:41    37  ******************
 340    2020-05-05 03:42    36  *****************
 ...    ..(  7 skipped).    ..  *****************
 348    2020-05-05 03:50    36  *****************
 349    2020-05-05 03:51    37  ******************
 ...    ..(  6 skipped).    ..  ******************
 356    2020-05-05 03:58    37  ******************
 357    2020-05-05 03:59    36  *****************
 ...    ..( 20 skipped).    ..  *****************
 378    2020-05-05 04:20    36  *****************
 379    2020-05-05 04:21    37  ******************
 380    2020-05-05 04:22    37  ******************
 381    2020-05-05 04:23    36  *****************
 ...    ..( 26 skipped).    ..  *****************
 408    2020-05-05 04:50    36  *****************
 409    2020-05-05 04:51    37  ******************
 ...    ..(  6 skipped).    ..  ******************
 416    2020-05-05 04:58    37  ******************
 417    2020-05-05 04:59    36  *****************
 ...    ..( 48 skipped).    ..  *****************
 466    2020-05-05 05:48    36  *****************
 467    2020-05-05 05:49    37  ******************
 468    2020-05-05 05:50    37  ******************
 469    2020-05-05 05:51    36  *****************
 ...    ..( 26 skipped).    ..  *****************
  18    2020-05-05 06:18    36  *****************
  19    2020-05-05 06:19    37  ******************
  20    2020-05-05 06:20    37  ******************
  21    2020-05-05 06:21    37  ******************
  22    2020-05-05 06:22    36  *****************
 ...    ..( 22 skipped).    ..  *****************
  45    2020-05-05 06:45    36  *****************
  46    2020-05-05 06:46    37  ******************
  47    2020-05-05 06:47    36  *****************
  48    2020-05-05 06:48    36  *****************
  49    2020-05-05 06:49    37  ******************
 ...    ..(  2 skipped).    ..  ******************
  52    2020-05-05 06:52    37  ******************
  53    2020-05-05 06:53    36  *****************
 ...    ..( 24 skipped).    ..  *****************
  78    2020-05-05 07:18    36  *****************
  79    2020-05-05 07:19    37  ******************
  80    2020-05-05 07:20    37  ******************
  81    2020-05-05 07:21    36  *****************
 ...    ..( 15 skipped).    ..  *****************
  97    2020-05-05 07:37    36  *****************
  98    2020-05-05 07:38    37  ******************
  99    2020-05-05 07:39    36  *****************
 100    2020-05-05 07:40    36  *****************
 101    2020-05-05 07:41    37  ******************
 102    2020-05-05 07:42    36  *****************
 ...    ..(  3 skipped).    ..  *****************
 106    2020-05-05 07:46    36  *****************
 107    2020-05-05 07:47    37  ******************
 108    2020-05-05 07:48    36  *****************
 109    2020-05-05 07:49    37  ******************
 ...    ..( 18 skipped).    ..  ******************
 128    2020-05-05 08:08    37  ******************
 129    2020-05-05 08:09    36  *****************
 130    2020-05-05 08:10    37  ******************
 131    2020-05-05 08:11    37  ******************
 132    2020-05-05 08:12    36  *****************
 ...    ..(  5 skipped).    ..  *****************
 138    2020-05-05 08:18    36  *****************
 139    2020-05-05 08:19    37  ******************
 ...    ..(  6 skipped).    ..  ******************
 146    2020-05-05 08:26    37  ******************
 147    2020-05-05 08:27    36  *****************
 ...    ..(  3 skipped).    ..  *****************
 151    2020-05-05 08:31    36  *****************
 152    2020-05-05 08:32    37  ******************
 153    2020-05-05 08:33    37  ******************
 154    2020-05-05 08:34    36  *****************
 ...    ..( 26 skipped).    ..  *****************
 181    2020-05-05 09:01    36  *****************
 182    2020-05-05 09:02    37  ******************
 183    2020-05-05 09:03    37  ******************
 184    2020-05-05 09:04    36  *****************
 ...    ..( 13 skipped).    ..  *****************
 198    2020-05-05 09:18    36  *****************
 199    2020-05-05 09:19    37  ******************
 200    2020-05-05 09:20    37  ******************
 201    2020-05-05 09:21    37  ******************
 202    2020-05-05 09:22    36  *****************
 ...    ..( 18 skipped).    ..  *****************
 221    2020-05-05 09:41    36  *****************
 222    2020-05-05 09:42    37  ******************
 223    2020-05-05 09:43    37  ******************
 224    2020-05-05 09:44    36  *****************
 ...    ..(  3 skipped).    ..  *****************
 228    2020-05-05 09:48    36  *****************
 229    2020-05-05 09:49    37  ******************
 230    2020-05-05 09:50    36  *****************
 ...    ..( 12 skipped).    ..  *****************
 243    2020-05-05 10:03    36  *****************
 244    2020-05-05 10:04    37  ******************
 245    2020-05-05 10:05    37  ******************
 246    2020-05-05 10:06    37  ******************
 247    2020-05-05 10:07    36  *****************
 ...    ..( 10 skipped).    ..  *****************
 258    2020-05-05 10:18    36  *****************
 259    2020-05-05 10:19    37  ******************
 260    2020-05-05 10:20    37  ******************
 261    2020-05-05 10:21    37  ******************
 262    2020-05-05 10:22    36  *****************
 ...    ..( 25 skipped).    ..  *****************
 288    2020-05-05 10:48    36  *****************
 289    2020-05-05 10:49    37  ******************
 290    2020-05-05 10:50    36  *****************
 ...    ..(  3 skipped).    ..  *****************
 294    2020-05-05 10:54    36  *****************

SCT Error Recovery Control command not supported

Device Statistics (GP/SMART Log 0x04) not supported

Pending Defects log (GP Log 0x0c) not supported

SATA Phy Event Counters (GP Log 0x11)
ID      Size     Value  Description
0x0001  2            0  Command failed due to ICRC error
0x0002  2            0  R_ERR response for data FIS
0x0003  2            0  R_ERR response for device-to-host data FIS
0x0004  2            0  R_ERR response for host-to-device data FIS
0x0005  2            0  R_ERR response for non-data FIS
0x0006  2            0  R_ERR response for device-to-host non-data FIS
0x0007  2            0  R_ERR response for host-to-device non-data FIS
0x000a  2           30  Device-to-host register FISes sent due to a COMRESET
0x000b  2            0  CRC errors within host-to-device FIS
0x8000  4       680889  Vendor specific

