smartctl 7.0 2019-03-31 r4903 [x86_64-linux-5.3.12-200.fc30.x86_64] (local build)
Copyright (C) 2002-18, Bruce Allen, Christian Franke, www.smartmontools.org

=== START OF INFORMATION SECTION ===
Device Model:     SK hynix SC311 SATA 512GB
Serial Number:    LINUXFABRIK205R1U
Firmware Version: 70000P10
User Capacity:    512’110’190’592 bytes [512 GB]
Sector Sizes:     512 bytes logical, 4096 bytes physical
Rotation Rate:    Solid State Device
Form Factor:      M.2
Device is:        Not in smartctl database [for details use: -P showall]
ATA Version is:   ACS-3 (minor revision not indicated)
SATA Version is:  SATA 3.2, 6.0 Gb/s (current: 6.0 Gb/s)
Local Time is:    Tue Dec  3 14:00:06 2019 CET
SMART support is: Available - device has SMART capability.
SMART support is: Enabled
AAM feature is:   Unavailable
APM feature is:   Disabled
Rd look-ahead is: Enabled
Write cache is:   Enabled
DSN feature is:   Unavailable
ATA Security is:  Disabled, NOT FROZEN [SEC1]
Wt Cache Reorder: Unknown

=== START OF READ SMART DATA SECTION ===
SMART overall-health self-assessment test result: PASSED

General SMART Values:
Offline data collection status:  (0x02)	Offline data collection activity
					was completed without error.
					Auto Offline Data Collection: Disabled.
Self-test execution status:      (   0)	The previous self-test routine completed
					without error or no self-test has ever 
					been run.
Total time to complete Offline 
data collection: 		(  110) seconds.
Offline data collection
capabilities: 			 (0x51) SMART execute Offline immediate.
					No Auto Offline data collection support.
					Suspend Offline collection upon new
					command.
					No Offline surface scan supported.
					Self-test supported.
					No Conveyance Self-test supported.
					Selective Self-test supported.
SMART capabilities:            (0x0002)	Does not save SMART data before
					entering power-saving mode.
					Supports SMART auto save timer.
Error logging capability:        (0x01)	Error logging supported.
					General Purpose Logging supported.
Short self-test routine 
recommended polling time: 	 (   2) minutes.
Extended self-test routine
recommended polling time: 	 (  80) minutes.
SCT capabilities: 	       (0x003d)	SCT Status supported.
					SCT Error Recovery Control supported.
					SCT Feature Control supported.
					SCT Data Table supported.

SMART Attributes Data Structure revision number: 0
Vendor Specific SMART Attributes with Thresholds:
ID# ATTRIBUTE_NAME          FLAGS    VALUE WORST THRESH FAIL RAW_VALUE
  1 Raw_Read_Error_Rate     POSR--   166   166   006    -    0
  5 Reallocated_Sector_Ct   -O--CK   253   253   036    -    0
  9 Power_On_Hours          -O--CK   093   093   000    -    6223
 12 Power_Cycle_Count       -O--CK   100   100   020    -    1689
100 Unknown_Attribute       -O--CK   100   100   000    -    788443
168 Unknown_Attribute       -O--CK   100   100   000    -    3
169 Unknown_Attribute       -O--CK   098   098   000    -    44
174 Unknown_Attribute       ----CK   100   100   000    -    134
175 Program_Fail_Count_Chip -O--CK   253   253   000    -    0
176 Erase_Fail_Count_Chip   -O--CK   253   253   000    -    0
177 Wear_Leveling_Count     -O--CK   100   001   000    -    14
178 Used_Rsvd_Blk_Cnt_Chip  -O--CK   253   253   000    -    0
179 Used_Rsvd_Blk_Cnt_Tot   -O--CK   253   253   000    -    0
180 Unused_Rsvd_Blk_Cnt_Tot -O--CK   100   100   000    -    1438
181 Program_Fail_Cnt_Total  -O--CK   253   253   000    -    0
182 Erase_Fail_Count_Total  -O--CK   253   253   000    -    0
184 End-to-End_Error        -O--CK   253   253   000    -    0
187 Reported_Uncorrect      -O--CK   253   253   000    -    0
188 Command_Timeout         -O--CK   100   100   000    -    96
194 Temperature_Celsius     -O----   036   000   000    -    36 (Min/Max 15/68)
195 Hardware_ECC_Recovered  -O--CK   253   253   000    -    0
196 Reallocated_Event_Count -O--CK   253   253   036    -    0
198 Offline_Uncorrectable   -O--CK   253   253   000    -    0
199 UDMA_CRC_Error_Count    -O--CK   253   253   000    -    0
204 Soft_ECC_Correction     -OSR--   001   001   000    -    14784
212 Unknown_Attribute       -O--CK   100   100   000    -    2397523
233 Media_Wearout_Indicator -O--CK   002   001   000    -    99
234 Unknown_Attribute       -O--CK   100   100   000    -    14120889632
241 Total_LBAs_Written      -O--CK   100   100   000    -    15394273879
242 Total_LBAs_Read         -O--CK   100   100   000    -    10291758381
                            ||||||_ K auto-keep
                            |||||__ C event count
                            ||||___ R error rate
                            |||____ S speed/performance
                            ||_____ O updated online
                            |______ P prefailure warning

General Purpose Log Directory Version 1
SMART           Log Directory Version 1 [multi-sector log support]
Address    Access  R/W   Size  Description
0x00       GPL,SL  R/O      1  Log Directory
0x01           SL  R/O      1  Summary SMART error log
0x02           SL  R/O      4  Comprehensive SMART error log
0x03       GPL     R/O      5  Ext. Comprehensive SMART error log
0x04       GPL,SL  R/O      8  Device Statistics log
0x06           SL  R/O      1  SMART self-test log
0x07       GPL     R/O      2  Extended self-test log
0x09           SL  R/W      1  Selective self-test log
0x10       GPL     R/O      1  NCQ Command Error log
0x11       GPL     R/O      1  SATA Phy Event Counters log
0x30       GPL     R/O      8  IDENTIFY DEVICE data log
0x80-0x9f  GPL,SL  R/W     16  Host vendor specific log
0xe0       GPL,SL  R/W      1  SCT Command/Status
0xe1       GPL,SL  R/W      1  SCT Data Transfer

SMART Extended Comprehensive Error Log Version: 1 (5 sectors)
No Errors Logged

SMART Extended Self-test Log Version: 1 (2 sectors)
Num  Test_Description    Status                  Remaining  LifeTime(hours)  LBA_of_first_error
# 1  Short offline       Completed without error       00%      6217         -
# 2  Extended offline    Completed without error       00%      6134         -
# 3  Short offline       Completed without error       00%         0         -

Warning! SMART Selective Self-Test Log Structure error: invalid SMART checksum.
SMART Selective self-test log data structure revision number 0
Note: revision number not 1 implies that no selective self-test has ever been run
 SPAN  MIN_LBA  MAX_LBA  CURRENT_TEST_STATUS
    1        0        0  Not_testing
    2        0        0  Not_testing
    3        0        0  Not_testing
    4        0        0  Not_testing
    5        0        0  Not_testing
Selective self-test flags (0x0):
  After scanning selected spans, do NOT read-scan remainder of disk.
If Selective self-test is pending on power-up, resume after 0 minute delay.

SCT Status Version:                  3
SCT Version (vendor specific):       1 (0x0001)
Device State:                        Active (0)
Current Temperature:                    36 Celsius
Power Cycle Min/Max Temperature:     23/37 Celsius
Lifetime    Min/Max Temperature:     15/68 Celsius
Specified Max Operating Temperature:    80 Celsius
Under/Over Temperature Limit Count:  287/0

SCT Temperature History Version:     2
Temperature Sampling Period:         1 minute
Temperature Logging Interval:        1 minute
Min/Max recommended Temperature:     -20/80 Celsius
Min/Max Temperature Limit:           -20/125 Celsius
Temperature History Size (Index):    192 (54)

Index    Estimated Time   Temperature Celsius
  55    2019-12-03 10:49    36  *****************
  56    2019-12-03 10:50    36  *****************
  57    2019-12-03 10:51    36  *****************
  58    2019-12-03 10:52     ?  -
  59    2019-12-03 10:53     ?  -
  60    2019-12-03 10:54    36  *****************
  61    2019-12-03 10:55     ?  -
 ...    ..( 22 skipped).    ..  -
  84    2019-12-03 11:18     ?  -
  85    2019-12-03 11:19    36  *****************
  86    2019-12-03 11:20     ?  -
 ...    ..( 32 skipped).    ..  -
 119    2019-12-03 11:53     ?  -
 120    2019-12-03 11:54    36  *****************
 121    2019-12-03 11:55     ?  -
 ...    ..( 68 skipped).    ..  -
 190    2019-12-03 13:04     ?  -
 191    2019-12-03 13:05    36  *****************
 ...    ..( 27 skipped).    ..  *****************
  27    2019-12-03 13:33    36  *****************
  28    2019-12-03 13:34    37  ******************
 ...    ..(  6 skipped).    ..  ******************
  35    2019-12-03 13:41    37  ******************
  36    2019-12-03 13:42    36  *****************
  37    2019-12-03 13:43    37  ******************
  38    2019-12-03 13:44    36  *****************
  39    2019-12-03 13:45    36  *****************
  40    2019-12-03 13:46    37  ******************
  41    2019-12-03 13:47    36  *****************
 ...    ..(  3 skipped).    ..  *****************
  45    2019-12-03 13:51    36  *****************
  46    2019-12-03 13:52     ?  -
 ...    ..(  4 skipped).    ..  -
  51    2019-12-03 13:57     ?  -
  52    2019-12-03 13:58    36  *****************
  53    2019-12-03 13:59     ?  -
  54    2019-12-03 14:00     ?  -

SCT Error Recovery Control:
           Read:     80 (8.0 seconds)
          Write:     80 (8.0 seconds)

Device Statistics (GP Log 0x04)
Page  Offset Size        Value Flags Description
0x01  =====  =               =  ===  == General Statistics (rev 2) ==
0x01  0x008  4            1689  ---  Lifetime Power-On Resets
0x01  0x010  4            6223  ---  Power-on Hours
0x01  0x018  6     15394273879  ---  Logical Sectors Written
0x01  0x020  6       251171348  ---  Number of Write Commands
0x01  0x028  6     10291758381  ---  Logical Sectors Read
0x01  0x030  6       177448223  ---  Number of Read Commands
0x01  0x038  6   1523569111858  ---  Date and Time TimeStamp
0x04  =====  =               =  ===  == General Errors Statistics (rev 1) ==
0x04  0x008  4               0  ---  Number of Reported Uncorrectable Errors
0x04  0x010  4              96  ---  Resets Between Cmd Acceptance and Completion
0x05  =====  =               =  ===  == Temperature Statistics (rev 1) ==
0x05  0x008  1              36  ---  Current Temperature
0x05  0x010  1              33  ---  Average Short Term Temperature
0x05  0x018  1               -  ---  Average Long Term Temperature
0x05  0x020  1              68  ---  Highest Temperature
0x05  0x028  1              15  ---  Lowest Temperature
0x05  0x030  1               -  ---  Highest Average Short Term Temperature
0x05  0x038  1              25  ---  Lowest Average Short Term Temperature
0x05  0x040  1               -  ---  Highest Average Long Term Temperature
0x05  0x048  1              32  ---  Lowest Average Long Term Temperature
0x05  0x050  4               0  ---  Time in Over-Temperature
0x05  0x058  1              80  ---  Specified Maximum Operating Temperature
0x05  0x060  4          363940  ---  Time in Under-Temperature
0x05  0x068  1             -20  ---  Specified Minimum Operating Temperature
0x06  =====  =               =  ===  == Transport Statistics (rev 1) ==
0x06  0x008  4            5036  ---  Number of Hardware Resets
0x06  0x018  4               0  ---  Number of Interface CRC Errors
0x07  =====  =               =  ===  == Solid State Device Statistics (rev 1) ==
0x07  0x008  1               0  ---  Percentage Used Endurance Indicator
                                |||_ C monitored condition met
                                ||__ D supports DSN
                                |___ N normalized value

Pending Defects log (GP Log 0x0c) not supported

SATA Phy Event Counters (GP Log 0x11)
ID      Size     Value  Description
0x0001  2            0  Command failed due to ICRC error
0x000a  2            2  Device-to-host register FISes sent due to a COMRESET
