smartctl 7.0 2018-12-30 r4883 [x86_64-linux-3.10.0-957.el7.x86_64] (local build)
Copyright (C) 2002-18, Bruce Allen, Christian Franke, www.smartmontools.org

=== START OF INFORMATION SECTION ===
Model Family:     Western Digital Gold
Device Model:     WDC WD101KRYZ-01JPDB0
Serial Number:    LINUXFABRIK
LU WWN Device Id: 5 000cca 251ee8419
Firmware Version: 01.01H01
User Capacity:    10'000'831'348'736 bytes [10.0 TB]
Sector Sizes:     512 bytes logical, 4096 bytes physical
Rotation Rate:    7200 rpm
Form Factor:      3.5 inches
Device is:        In smartctl database [for details use: -P show]
ATA Version is:   ACS-2, ATA8-ACS T13/1699-D revision 4
SATA Version is:  SATA 3.2, 6.0 Gb/s (current: 6.0 Gb/s)
Local Time is:    Wed Apr  1 08:52:06 2020 EDT
SMART support is: Available - device has SMART capability.
SMART support is: Enabled
AAM feature is:   Unavailable
APM feature is:   Disabled
Rd look-ahead is: Enabled
Write cache is:   Enabled
DSN feature is:   Unavailable
ATA Security is:  Disabled, frozen [SEC2]
Wt Cache Reorder: Enabled

=== START OF READ SMART DATA SECTION ===
SMART overall-health self-assessment test result: PASSED

General SMART Values:
Offline data collection status:  (0x80)	Offline data collection activity
					was never started.
					Auto Offline Data Collection: Enabled.
Self-test execution status:      (   0)	The previous self-test routine completed
					without error or no self-test has ever 
					been run.
Total time to complete Offline 
data collection: 		(   93) seconds.
Offline data collection
capabilities: 			 (0x5b) SMART execute Offline immediate.
					Auto Offline data collection on/off support.
					Suspend Offline collection upon new
					command.
					Offline surface scan supported.
					Self-test supported.
					No Conveyance Self-test supported.
					Selective Self-test supported.
SMART capabilities:            (0x0003)	Saves SMART data before entering
					power-saving mode.
					Supports SMART auto save timer.
Error logging capability:        (0x01)	Error logging supported.
					General Purpose Logging supported.
Short self-test routine 
recommended polling time: 	 (   2) minutes.
Extended self-test routine
recommended polling time: 	 (1127) minutes.
SCT capabilities: 	       (0x003d)	SCT Status supported.
					SCT Error Recovery Control supported.
					SCT Feature Control supported.
					SCT Data Table supported.

SMART Attributes Data Structure revision number: 16
Vendor Specific SMART Attributes with Thresholds:
ID# ATTRIBUTE_NAME          FLAGS    VALUE WORST THRESH FAIL RAW_VALUE
  1 Raw_Read_Error_Rate     PO-R--   100   100   016    -    0
  2 Throughput_Performance  P-S---   134   134   054    -    96
  3 Spin_Up_Time            POS---   151   151   024    -    444 (Average 424)
  4 Start_Stop_Count        -O--C-   100   100   000    -    42
  5 Reallocated_Sector_Ct   PO--CK   100   100   005    -    0
  7 Seek_Error_Rate         PO-R--   100   100   067    -    0
  8 Seek_Time_Performance   P-S---   128   128   020    -    18
  9 Power_On_Hours          -O--C-   097   097   000    -    25179
 10 Spin_Retry_Count        PO--C-   100   100   060    -    0
 12 Power_Cycle_Count       -O--CK   100   100   000    -    13
 22 Helium_Level            PO---K   100   100   025    -    100
192 Power-Off_Retract_Count -O--CK   064   064   000    -    43544
193 Load_Cycle_Count        -O--C-   064   064   000    -    43544
194 Temperature_Celsius     -O----   171   171   000    -    35 (Min/Max 25/44)
196 Reallocated_Event_Count -O--CK   100   100   000    -    0
197 Current_Pending_Sector  -O---K   100   100   000    -    0
198 Offline_Uncorrectable   ---R--   100   100   000    -    0
199 UDMA_CRC_Error_Count    -O-R--   200   200   000    -    0
                            ||||||_ K auto-keep
                            |||||__ C event count
                            ||||___ R error rate
                            |||____ S speed/performance
                            ||_____ O updated online
                            |______ P prefailure warning

General Purpose Log Directory Version 1
SMART           Log Directory Version 1 [multi-sector log support]
Address    Access  R/W   Size  Description
0x00       GPL,SL  R/O      1  Log Directory
0x01           SL  R/O      1  Summary SMART error log
0x02           SL  R/O      1  Comprehensive SMART error log
0x03       GPL     R/O      1  Ext. Comprehensive SMART error log
0x04       GPL     R/O    256  Device Statistics log
0x04       SL      R/O    255  Device Statistics log
0x06           SL  R/O      1  SMART self-test log
0x07       GPL     R/O      1  Extended self-test log
0x08       GPL     R/O      2  Power Conditions log
0x09           SL  R/W      1  Selective self-test log
0x0c       GPL     R/O   5501  Pending Defects log
0x10       GPL     R/O      1  NCQ Command Error log
0x11       GPL     R/O      1  SATA Phy Event Counters log
0x12       GPL     R/O      1  SATA NCQ Non-Data log
0x13       GPL     R/O      1  SATA NCQ Send and Receive log
0x15       GPL,SL  R/W      1  Rebuild Assist log
0x21       GPL     R/O      1  Write stream error log
0x22       GPL     R/O      1  Read stream error log
0x24       GPL     R/O    256  Current Device Internal Status Data log
0x25       GPL     R/O    256  Saved Device Internal Status Data log
0x30       GPL,SL  R/O      9  IDENTIFY DEVICE data log
0x80-0x9f  GPL,SL  R/W     16  Host vendor specific log
0xe0       GPL,SL  R/W      1  SCT Command/Status
0xe1       GPL,SL  R/W      1  SCT Data Transfer

SMART Extended Comprehensive Error Log Version: 1 (1 sectors)
No Errors Logged

SMART Extended Self-test Log Version: 1 (1 sectors)
No self-tests have been logged.  [To run self-tests, use: smartctl -t]

SMART Selective self-test log data structure revision number 1
 SPAN  MIN_LBA  MAX_LBA  CURRENT_TEST_STATUS
    1        0        0  Not_testing
    2        0        0  Not_testing
    3        0        0  Not_testing
    4        0        0  Not_testing
    5        0        0  Not_testing
Selective self-test flags (0x0):
  After scanning selected spans, do NOT read-scan remainder of disk.
If Selective self-test is pending on power-up, resume after 0 minute delay.

SCT Status Version:                  3
SCT Version (vendor specific):       256 (0x0100)
Device State:                        Active (0)
Current Temperature:                    35 Celsius
Power Cycle Min/Max Temperature:     29/35 Celsius
Lifetime    Min/Max Temperature:     25/44 Celsius
Under/Over Temperature Limit Count:   0/0

SCT Temperature History Version:     2
Temperature Sampling Period:         1 minute
Temperature Logging Interval:        1 minute
Min/Max recommended Temperature:      0/60 Celsius
Min/Max Temperature Limit:           -40/70 Celsius
Temperature History Size (Index):    128 (101)

Index    Estimated Time   Temperature Celsius
 102    2020-04-01 06:45    30  ***********
 ...    ..(  7 skipped).    ..  ***********
 110    2020-04-01 06:53    30  ***********
 111    2020-04-01 06:54    29  **********
 112    2020-04-01 06:55    30  ***********
 113    2020-04-01 06:56    29  **********
 ...    ..( 19 skipped).    ..  **********
   5    2020-04-01 07:16    29  **********
   6    2020-04-01 07:17    30  ***********
   7    2020-04-01 07:18    30  ***********
   8    2020-04-01 07:19    26  *******
   9    2020-04-01 07:20    26  *******
  10    2020-04-01 07:21    26  *******
  11    2020-04-01 07:22    27  ********
  12    2020-04-01 07:23    27  ********
  13    2020-04-01 07:24    28  *********
 ...    ..(  2 skipped).    ..  *********
  16    2020-04-01 07:27    28  *********
  17    2020-04-01 07:28    29  **********
  18    2020-04-01 07:29    29  **********
  19    2020-04-01 07:30    29  **********
  20    2020-04-01 07:31    30  ***********
  21    2020-04-01 07:32    29  **********
  22    2020-04-01 07:33    29  **********
  23    2020-04-01 07:34    29  **********
  24    2020-04-01 07:35    30  ***********
 ...    ..(  2 skipped).    ..  ***********
  27    2020-04-01 07:38    30  ***********
  28    2020-04-01 07:39    31  ************
 ...    ..(  3 skipped).    ..  ************
  32    2020-04-01 07:43    31  ************
  33    2020-04-01 07:44    32  *************
 ...    ..(  5 skipped).    ..  *************
  39    2020-04-01 07:50    32  *************
  40    2020-04-01 07:51    33  **************
 ...    ..(  9 skipped).    ..  **************
  50    2020-04-01 08:01    33  **************
  51    2020-04-01 08:02    34  ***************
  52    2020-04-01 08:03    33  **************
 ...    ..(  4 skipped).    ..  **************
  57    2020-04-01 08:08    33  **************
  58    2020-04-01 08:09    34  ***************
 ...    ..( 32 skipped).    ..  ***************
  91    2020-04-01 08:42    34  ***************
  92    2020-04-01 08:43    35  ****************
 ...    ..(  7 skipped).    ..  ****************
 100    2020-04-01 08:51    35  ****************
 101    2020-04-01 08:52    30  ***********

SCT Error Recovery Control:
           Read: Disabled
          Write: Disabled

Device Statistics (GP Log 0x04)
Page  Offset Size        Value Flags Description
0x01  =====  =               =  ===  == General Statistics (rev 1) ==
0x01  0x008  4              13  ---  Lifetime Power-On Resets
0x01  0x018  6    105471376724  ---  Logical Sectors Written
0x01  0x020  6       609180149  ---  Number of Write Commands
0x01  0x028  6     88210882990  ---  Logical Sectors Read
0x01  0x030  6       516638579  ---  Number of Read Commands
0x01  0x038  6     90644671350  ---  Date and Time TimeStamp
0x03  =====  =               =  ===  == Rotating Media Statistics (rev 1) ==
0x03  0x008  4           10395  ---  Spindle Motor Power-on Hours
0x03  0x010  4           10395  ---  Head Flying Hours
0x03  0x018  4           43544  ---  Head Load Events
0x03  0x020  4               0  ---  Number of Reallocated Logical Sectors
0x03  0x028  4         1464040  ---  Read Recovery Attempts
0x03  0x030  4               1  ---  Number of Mechanical Start Failures
0x04  =====  =               =  ===  == General Errors Statistics (rev 1) ==
0x04  0x008  4               0  ---  Number of Reported Uncorrectable Errors
0x04  0x010  4               1  ---  Resets Between Cmd Acceptance and Completion
0x05  =====  =               =  ===  == Temperature Statistics (rev 1) ==
0x05  0x008  1              35  ---  Current Temperature
0x05  0x010  1              36  N--  Average Short Term Temperature
0x05  0x018  1              34  N--  Average Long Term Temperature
0x05  0x020  1              44  ---  Highest Temperature
0x05  0x028  1              25  ---  Lowest Temperature
0x05  0x030  1              43  N--  Highest Average Short Term Temperature
0x05  0x038  1              25  N--  Lowest Average Short Term Temperature
0x05  0x040  1              36  N--  Highest Average Long Term Temperature
0x05  0x048  1              25  N--  Lowest Average Long Term Temperature
0x05  0x050  4               0  ---  Time in Over-Temperature
0x05  0x058  1              60  ---  Specified Maximum Operating Temperature
0x05  0x060  4               0  ---  Time in Under-Temperature
0x05  0x068  1               0  ---  Specified Minimum Operating Temperature
0x06  =====  =               =  ===  == Transport Statistics (rev 1) ==
0x06  0x008  4              51  ---  Number of Hardware Resets
0x06  0x010  4              42  ---  Number of ASR Events
0x06  0x018  4               0  ---  Number of Interface CRC Errors
0xff  =====  =               =  ===  == Vendor Specific Statistics (rev 1) ==
                                |||_ C monitored condition met
                                ||__ D supports DSN
                                |___ N normalized value

Pending Defects log (GP Log 0x0c)
No Defects Logged

SATA Phy Event Counters (GP Log 0x11)
ID      Size     Value  Description
0x0001  2            0  Command failed due to ICRC error
0x0002  2            0  R_ERR response for data FIS
0x0003  2            0  R_ERR response for device-to-host data FIS
0x0004  2            0  R_ERR response for host-to-device data FIS
0x0005  2            0  R_ERR response for non-data FIS
0x0006  2            0  R_ERR response for device-to-host non-data FIS
0x0007  2            0  R_ERR response for host-to-device non-data FIS
0x0008  2            0  Device-to-host non-data FIS retries
0x0009  2           82  Transition from drive PhyRdy to drive PhyNRdy
0x000a  2           47  Device-to-host register FISes sent due to a COMRESET
0x000b  2            0  CRC errors within host-to-device FIS
0x000d  2            0  Non-CRC errors within host-to-device FIS

