smartctl 7.0 2019-03-31 r4903 [x86_64-linux-5.3.12-200.fc30.x86_64] (local build)
Copyright (C) 2002-18, Bruce Allen, Christian Franke, www.smartmontools.org

=== START OF INFORMATION SECTION ===
Model Family:     Seagate Barracuda LP
Device Model:     ST32000542AS
Serial Number:    LINUXFABRIK
LU WWN Device Id: 5 000c50 02ab8edf5
Firmware Version: CC34
User Capacity:    2’000’398’934’016 bytes [2.00 TB]
Sector Size:      512 bytes logical/physical
Rotation Rate:    5900 rpm
Device is:        In smartctl database [for details use: -P show]
ATA Version is:   ATA8-ACS T13/1699-D revision 4
SATA Version is:  SATA 2.6, 3.0 Gb/s
Local Time is:    Tue Dec  3 13:44:25 2019 CET

==> WARNING: A firmware update for this drive may be available,
see the following Seagate web pages:
http://knowledge.seagate.com/articles/en_US/FAQ/207931en
http://knowledge.seagate.com/articles/en_US/FAQ/213915en

==> WARNING: I am another possible warning
see the following Seagate web pages:
http://knowledge.seagate.com/articles/en_US/FAQ/207931en
http://knowledge.seagate.com/articles/en_US/FAQ/213915en

==> WARNING: >> Terminate command early due to bad response to IEC mode page
see the following Seagate web pages: I will not be outputted as a warning
http://knowledge.seagate.com/articles/en_US/FAQ/207931en
http://knowledge.seagate.com/articles/en_US/FAQ/213915en

SMART support is: Available - device has SMART capability.
SMART support is: Enabled
AAM level is:     0 (vendor specific), recommended: 254
APM level is:     192 (intermediate level without standby)
Rd look-ahead is: Enabled
Write cache is:   Enabled
DSN feature is:   Unavailable
ATA Security is:  Disabled, NOT FROZEN [SEC1]
Wt Cache Reorder: Unknown

=== START OF READ SMART DATA SECTION ===
SMART overall-health self-assessment test result: FAILED!
Drive failure expected in less than 24 hours. SAVE ALL DATA.
See vendor-specific Attribute list for failed Attributes.

General SMART Values:
Offline data collection status:  (0x00)	Offline data collection activity
					was never started.
					Auto Offline Data Collection: Disabled.
Self-test execution status:      (   0)	The previous self-test routine completed
					without error or no self-test has ever 
					been run.
Total time to complete Offline 
data collection: 		(  643) seconds.
Offline data collection
capabilities: 			 (0x73) SMART execute Offline immediate.
					Auto Offline data collection on/off support.
					Suspend Offline collection upon new
					command.
					No Offline surface scan supported.
					Self-test supported.
					Conveyance Self-test supported.
					Selective Self-test supported.
SMART capabilities:            (0x0003)	Saves SMART data before entering
					power-saving mode.
					Supports SMART auto save timer.
Error logging capability:        (0x01)	Error logging supported.
					General Purpose Logging supported.
Short self-test routine 
recommended polling time: 	 (   1) minutes.
Extended self-test routine
recommended polling time: 	 ( 462) minutes.
Conveyance self-test routine
recommended polling time: 	 (   2) minutes.
SCT capabilities: 	       (0x103f)	SCT Status supported.
					SCT Error Recovery Control supported.
					SCT Feature Control supported.
					SCT Data Table supported.

SMART Attributes Data Structure revision number: 10
Vendor Specific SMART Attributes with Thresholds:
ID# ATTRIBUTE_NAME          FLAGS    VALUE WORST THRESH FAIL RAW_VALUE
  1 Raw_Read_Error_Rate     POSR--   095   093   006    -    206969285
  3 Spin_Up_Time            PO----   100   100   000    -    0
  4 Start_Stop_Count        -O--CK   100   100   020    -    28
  5 Reallocated_Sector_Ct   PO--CK   004   004   036    NOW  3956
  7 Seek_Error_Rate         POSR--   074   060   030    -    27571332
  9 Power_On_Hours          -O--CK   080   080   000    -    18319
 10 Spin_Retry_Count        PO--C-   100   100   097    -    0
 12 Power_Cycle_Count       -O--CK   100   100   020    -    27
183 Runtime_Bad_Block       -O--CK   096   096   000    -    4
184 End-to-End_Error        -O--CK   100   100   099    -    0
187 Reported_Uncorrect      -O--CK   100   100   000    -    0
188 Command_Timeout         -O--CK   100   099   000    -    8590065667
189 High_Fly_Writes         -O-RCK   100   100   000    -    0
190 Airflow_Temperature_Cel -O---K   078   058   045    -    22 (Min/Max 22/22)
194 Temperature_Celsius     -O---K   022   042   000    -    22 (0 20 0 0 0)
195 Hardware_ECC_Recovered  -O-RC-   023   017   000    -    206969285
197 Current_Pending_Sector  -O--C-   100   100   000    -    0
198 Offline_Uncorrectable   ----C-   100   100   000    -    0
199 UDMA_CRC_Error_Count    -OSRCK   200   200   000    -    4
240 Head_Flying_Hours       ------   100   253   000    -    18386 (132 95 0)
241 Total_LBAs_Written      ------   100   253   000    -    3973655019
242 Total_LBAs_Read         ------   100   253   000    -    3238867291
                            ||||||_ K auto-keep
                            |||||__ C event count
                            ||||___ R error rate
                            |||____ S speed/performance
                            ||_____ O updated online
                            |______ P prefailure warning

General Purpose Log Directory Version 1
SMART           Log Directory Version 1 [multi-sector log support]
Address    Access  R/W   Size  Description
0x00       GPL,SL  R/O      1  Log Directory
0x01       GPL,SL  R/O      1  Summary SMART error log
0x02       GPL,SL  R/O      5  Comprehensive SMART error log
0x03       GPL,SL  R/O      5  Ext. Comprehensive SMART error log
0x06       GPL,SL  R/O      1  SMART self-test log
0x07       GPL,SL  R/O      1  Extended self-test log
0x09       GPL,SL  R/W      1  Selective self-test log
0x10       GPL,SL  R/O      1  NCQ Command Error log
0x11       GPL,SL  R/O      1  SATA Phy Event Counters log
0x21       GPL,SL  R/O      1  Write stream error log
0x22       GPL,SL  R/O      1  Read stream error log
0x80-0x9f  GPL,SL  R/W     16  Host vendor specific log
0xa1       GPL,SL  VS      20  Device vendor specific log
0xa2       GPL     VS    2248  Device vendor specific log
0xa8       GPL,SL  VS     129  Device vendor specific log
0xa9       GPL,SL  VS       1  Device vendor specific log
0xb0       GPL     VS    2928  Device vendor specific log
0xbd       GPL,SL  VS     252  Device vendor specific log
0xbe-0xbf  GPL     VS   65535  Device vendor specific log
0xc0       GPL,SL  VS       1  Device vendor specific log
0xe0       GPL,SL  R/W      1  SCT Command/Status
0xe1       GPL,SL  R/W      1  SCT Data Transfer

SMART Extended Comprehensive Error Log Version: 1 (5 sectors)
No Errors Logged

SMART Extended Self-test Log Version: 1 (1 sectors)
Num  Test_Description    Status                  Remaining  LifeTime(hours)  LBA_of_first_error
# 1  Short offline       Completed: unknown failure    90%     18317         0
# 2  Short offline       Completed: unknown failure    90%     18317         0
# 3  Short offline       Completed: unknown failure    90%     18317         0
# 4  Short offline       Completed without error       00%         0         -

SMART Selective self-test log data structure revision number 1
 SPAN  MIN_LBA  MAX_LBA  CURRENT_TEST_STATUS
    1        0        0  Not_testing
    2        0        0  Not_testing
    3        0        0  Not_testing
    4        0        0  Not_testing
    5        0        0  Not_testing
Selective self-test flags (0x0):
  After scanning selected spans, do NOT read-scan remainder of disk.
If Selective self-test is pending on power-up, resume after 0 minute delay.

SCT Status Version:                  3
SCT Version (vendor specific):       522 (0x020a)
Device State:                        Active (0)
Current Temperature:                    22 Celsius
Power Cycle Min/Max Temperature:     22/22 Celsius
Lifetime    Min/Max Temperature:     20/42 Celsius
Under/Over Temperature Limit Count:   0/0

SCT Temperature History Version:     2
Temperature Sampling Period:         10 minutes
Temperature Logging Interval:        59 minutes
Min/Max recommended Temperature:     14/55 Celsius
Min/Max Temperature Limit:           10/60 Celsius
Temperature History Size (Index):    128 (51)

Index    Estimated Time   Temperature Celsius
  52    2019-11-28 08:06    37  ******************
 ...    ..(  2 skipped).    ..  ******************
  55    2019-11-28 11:03    37  ******************
  56    2019-11-28 12:02    36  *****************
  57    2019-11-28 13:01    37  ******************
  58    2019-11-28 14:00    37  ******************
  59    2019-11-28 14:59    37  ******************
  60    2019-11-28 15:58    36  *****************
 ...    ..(  9 skipped).    ..  *****************
  70    2019-11-29 01:48    36  *****************
  71    2019-11-29 02:47    37  ******************
  72    2019-11-29 03:46    36  *****************
 ...    ..( 41 skipped).    ..  *****************
 114    2019-11-30 21:04    36  *****************
 115    2019-11-30 22:03    34  ***************
 116    2019-11-30 23:02    35  ****************
 117    2019-12-01 00:01    34  ***************
 118    2019-12-01 01:00    33  **************
 119    2019-12-01 01:59    34  ***************
 120    2019-12-01 02:58    34  ***************
 121    2019-12-01 03:57    34  ***************
 122    2019-12-01 04:56    33  **************
 ...    ..(  3 skipped).    ..  **************
 126    2019-12-01 08:52    33  **************
 127    2019-12-01 09:51    34  ***************
 ...    ..(  7 skipped).    ..  ***************
   7    2019-12-01 17:43    34  ***************
   8    2019-12-01 18:42    35  ****************
 ...    ..(  3 skipped).    ..  ****************
  12    2019-12-01 22:38    35  ****************
  13    2019-12-01 23:37    34  ***************
 ...    ..( 14 skipped).    ..  ***************
  28    2019-12-02 14:22    34  ***************
  29    2019-12-02 15:21    35  ****************
  30    2019-12-02 16:20    35  ****************
  31    2019-12-02 17:19    36  *****************
  32    2019-12-02 18:18    37  ******************
  33    2019-12-02 19:17    37  ******************
  34    2019-12-02 20:16     ?  -
  35    2019-12-02 21:15    32  *************
  36    2019-12-02 22:14     ?  -
  37    2019-12-02 23:13    23  ****
  38    2019-12-03 00:12    23  ****
  39    2019-12-03 01:11    36  *****************
  40    2019-12-03 02:10     ?  -
  41    2019-12-03 03:09    24  *****
  42    2019-12-03 04:08     ?  -
  43    2019-12-03 05:07    24  *****
  44    2019-12-03 06:06     ?  -
  45    2019-12-03 07:05    21  **
  46    2019-12-03 08:04     ?  -
  47    2019-12-03 09:03    23  ****
  48    2019-12-03 10:02     ?  -
  49    2019-12-03 11:01    21  **
  50    2019-12-03 12:00     ?  -
  51    2019-12-03 12:59    22  ***

SCT Error Recovery Control:
           Read: Disabled
          Write: Disabled

Device Statistics (GP/SMART Log 0x04) not supported

Pending Defects log (GP Log 0x0c) not supported

SATA Phy Event Counters (GP Log 0x11)
ID      Size     Value  Description
0x000a  2            1  Device-to-host register FISes sent due to a COMRESET
0x0001  2            0  Command failed due to ICRC error
0x0003  2            0  R_ERR response for device-to-host data FIS
0x0004  2            0  R_ERR response for host-to-device data FIS
0x0006  2            0  R_ERR response for device-to-host non-data FIS
0x0007  2            0  R_ERR response for host-to-device non-data FIS

