smartctl 7.0 2019-03-31 r4903 [x86_64-linux-5.3.12-200.fc30.x86_64] (local build)
Copyright (C) 2002-18, Bruce Allen, Christian Franke, www.smartmontools.org

=== START OF INFORMATION SECTION ===
Model Family:     Western Digital RE4
Device Model:     WDC WD1003FBYZ-010FB0
Serial Number:    LINUXFABRIKXJ1F
LU WWN Device Id: 5 0014ee 20a80578e
Firmware Version: 01.01V03
User Capacity:    1’000’204’886’016 bytes [1.00 TB]
Sector Size:      512 bytes logical/physical
Rotation Rate:    7200 rpm
Device is:        In smartctl database [for details use: -P show]
ATA Version is:   ATA8-ACS (minor revision not indicated)
SATA Version is:  SATA 3.0, 6.0 Gb/s (current: 6.0 Gb/s)
Local Time is:    Tue Dec  3 16:05:32 2019 CET
SMART support is: Available - device has SMART capability.
SMART support is: Enabled
AAM feature is:   Unavailable
APM level is:     128 (minimum power consumption without standby)
Rd look-ahead is: Enabled
Write cache is:   Enabled
DSN feature is:   Unavailable
ATA Security is:  Disabled, NOT FROZEN [SEC1]
Wt Cache Reorder: Enabled

=== START OF READ SMART DATA SECTION ===
SMART overall-health self-assessment test result: PASSED

General SMART Values:
Offline data collection status:  (0x82)	Offline data collection activity
					was completed without error.
					Auto Offline Data Collection: Enabled.
Self-test execution status:      (   0)	The previous self-test routine completed
					without error or no self-test has ever 
					been run.
Total time to complete Offline 
data collection: 		(16680) seconds.
Offline data collection
capabilities: 			 (0x7b) SMART execute Offline immediate.
					Auto Offline data collection on/off support.
					Suspend Offline collection upon new
					command.
					Offline surface scan supported.
					Self-test supported.
					Conveyance Self-test supported.
					Selective Self-test supported.
SMART capabilities:            (0x0003)	Saves SMART data before entering
					power-saving mode.
					Supports SMART auto save timer.
Error logging capability:        (0x01)	Error logging supported.
					General Purpose Logging supported.
Short self-test routine 
recommended polling time: 	 (   2) minutes.
Extended self-test routine
recommended polling time: 	 ( 164) minutes.
Conveyance self-test routine
recommended polling time: 	 (   5) minutes.
SCT capabilities: 	       (0x303f)	SCT Status supported.
					SCT Error Recovery Control supported.
					SCT Feature Control supported.
					SCT Data Table supported.

SMART Attributes Data Structure revision number: 16
Vendor Specific SMART Attributes with Thresholds:
ID# ATTRIBUTE_NAME          FLAGS    VALUE WORST THRESH FAIL RAW_VALUE
  1 Raw_Read_Error_Rate     POSR-K   200   200   051    -    2
  3 Spin_Up_Time            POS--K   184   174   021    -    3758
  4 Start_Stop_Count        -O--CK   100   100   000    -    26
  5 Reallocated_Sector_Ct   PO--CK   200   200   140    -    0
  7 Seek_Error_Rate         -OSR-K   200   200   000    -    0
  9 Power_On_Hours          -O--CK   076   076   000    -    17587
 10 Spin_Retry_Count        -O--CK   100   253   000    -    0
 11 Calibration_Retry_Count -O--CK   100   253   000    -    0
 12 Power_Cycle_Count       -O--CK   100   100   000    -    26
192 Power-Off_Retract_Count -O--CK   200   200   000    -    17
193 Load_Cycle_Count        -O--CK   200   200   000    -    47
194 Temperature_Celsius     -O---K   124   104   000    -    23
196 Reallocated_Event_Count -O--CK   200   200   000    -    0
197 Current_Pending_Sector  -O--CK   200   200   000    -    0
198 Offline_Uncorrectable   ----CK   200   200   000    -    0
199 UDMA_CRC_Error_Count    -O--CK   200   200   000    -    0
200 Multi_Zone_Error_Rate   ---R--   200   200   000    -    14
                            ||||||_ K auto-keep
                            |||||__ C event count
                            ||||___ R error rate
                            |||____ S speed/performance
                            ||_____ O updated online
                            |______ P prefailure warning

General Purpose Log Directory Version 1
SMART           Log Directory Version 1 [multi-sector log support]
Address    Access  R/W   Size  Description
0x00       GPL,SL  R/O      1  Log Directory
0x01           SL  R/O      1  Summary SMART error log
0x02           SL  R/O      5  Comprehensive SMART error log
0x03       GPL     R/O      6  Ext. Comprehensive SMART error log
0x06           SL  R/O      1  SMART self-test log
0x07       GPL     R/O      1  Extended self-test log
0x08       GPL     R/O      2  Power Conditions log
0x09           SL  R/W      1  Selective self-test log
0x10       GPL     R/O      1  NCQ Command Error log
0x11       GPL     R/O      1  SATA Phy Event Counters log
0x80-0x9f  GPL,SL  R/W     16  Host vendor specific log
0xa0-0xa7  GPL,SL  VS      16  Device vendor specific log
0xa8-0xb5  GPL,SL  VS       1  Device vendor specific log
0xb6       GPL     VS       1  Device vendor specific log
0xb7       GPL,SL  VS       1  Device vendor specific log
0xbd       GPL,SL  VS       1  Device vendor specific log
0xc0       GPL,SL  VS       1  Device vendor specific log
0xc1       GPL     VS      24  Device vendor specific log
0xe0       GPL,SL  R/W      1  SCT Command/Status
0xe1       GPL,SL  R/W      1  SCT Data Transfer

SMART Extended Comprehensive Error Log Version: 1 (6 sectors)
Device Error Count: 30 (device log contains only the most recent 24 errors)
	CR     = Command Register
	FEATR  = Features Register
	COUNT  = Count (was: Sector Count) Register
	LBA_48 = Upper bytes of LBA High/Mid/Low Registers ]  ATA-8
	LH     = LBA High (was: Cylinder High) Register    ]   LBA
	LM     = LBA Mid (was: Cylinder Low) Register      ] Register
	LL     = LBA Low (was: Sector Number) Register     ]
	DV     = Device (was: Device/Head) Register
	DC     = Device Control Register
	ER     = Error register
	ST     = Status register
Powered_Up_Time is measured from power on, and printed as
DDd+hh:mm:SS.sss where DD=days, hh=hours, mm=minutes,
SS=sec, and sss=millisec. It "wraps" after 49.710 days.

Error 30 [5] occurred at disk power-on lifetime: 17401 hours (725 days + 1 hours)
  When the command that caused the error occurred, the device was active or idle.

  After command completion occurred, registers were:
  ER -- ST COUNT  LBA_48  LH LM LL DV DC
  -- -- -- == -- == == == -- -- -- -- --
  04 -- 51 00 00 00 00 00 f7 df 38 a7 00

  Commands leading to the command that caused the error were:
  CR FEATR COUNT  LBA_48  LH LM LL DV DC  Powered_Up_Time  Command/Feature_Name
  -- == -- == -- == == == -- -- -- -- --  ---------------  --------------------
  ea 00 00 00 00 00 00 00 00 00 00 e0 08 28d+03:05:13.578  FLUSH CACHE EXT
  ef 00 10 00 02 00 00 00 00 00 00 a0 08 28d+03:05:13.577  SET FEATURES [Enable SATA feature]
  27 00 00 00 00 00 00 00 00 00 00 e0 08 28d+03:05:13.577  READ NATIVE MAX ADDRESS EXT [OBS-ACS-3]
  ec 00 00 00 00 00 00 00 00 00 00 a0 08 28d+03:05:13.576  IDENTIFY DEVICE
  ef 00 03 00 46 00 00 00 00 00 00 a0 08 28d+03:05:13.576  SET FEATURES [Set transfer mode]

Error 29 [4] occurred at disk power-on lifetime: 17401 hours (725 days + 1 hours)
  When the command that caused the error occurred, the device was active or idle.

  After command completion occurred, registers were:
  ER -- ST COUNT  LBA_48  LH LM LL DV DC
  -- -- -- == -- == == == -- -- -- -- --
  04 -- 51 00 00 00 00 00 f7 df 38 a7 00

  Commands leading to the command that caused the error were:
  CR FEATR COUNT  LBA_48  LH LM LL DV DC  Powered_Up_Time  Command/Feature_Name
  -- == -- == -- == == == -- -- -- -- --  ---------------  --------------------
  ea 00 00 00 00 00 00 00 00 00 00 e0 08 28d+03:05:06.570  FLUSH CACHE EXT
  35 00 00 00 08 00 00 6b 47 68 08 e0 08 28d+03:05:06.558  WRITE DMA EXT
  35 00 00 00 08 00 00 6b 07 b1 48 e0 08 28d+03:05:05.923  WRITE DMA EXT
  35 00 00 00 08 00 00 6b 07 6d 38 e0 08 28d+03:05:05.923  WRITE DMA EXT
  35 00 00 00 08 00 00 6b 07 6a f8 e0 08 28d+03:05:05.920  WRITE DMA EXT

Error 28 [3] occurred at disk power-on lifetime: 17400 hours (725 days + 0 hours)
  When the command that caused the error occurred, the device was active or idle.

  After command completion occurred, registers were:
  ER -- ST COUNT  LBA_48  LH LM LL DV DC
  -- -- -- == -- == == == -- -- -- -- --
  04 -- 51 00 00 00 00 00 f7 df 38 a7 00

  Commands leading to the command that caused the error were:
  CR FEATR COUNT  LBA_48  LH LM LL DV DC  Powered_Up_Time  Command/Feature_Name
  -- == -- == -- == == == -- -- -- -- --  ---------------  --------------------
  ea 00 00 00 00 00 00 00 00 00 00 e0 08 28d+02:37:08.219  FLUSH CACHE EXT
  ea 00 00 00 00 00 00 00 00 00 00 e0 08 28d+02:37:03.466  FLUSH CACHE EXT
  ca 00 00 00 01 00 00 01 03 68 08 e1 08 28d+02:37:03.466  WRITE DMA
  ea 00 00 00 00 00 00 00 00 00 00 e0 08 28d+02:37:03.466  FLUSH CACHE EXT
  ea 00 00 00 00 00 00 00 00 00 00 e0 08 28d+02:37:03.452  FLUSH CACHE EXT

Error 27 [2] occurred at disk power-on lifetime: 17400 hours (725 days + 0 hours)
  When the command that caused the error occurred, the device was active or idle.

  After command completion occurred, registers were:
  ER -- ST COUNT  LBA_48  LH LM LL DV DC
  -- -- -- == -- == == == -- -- -- -- --
  04 -- 51 00 00 00 00 00 f7 df 38 a7 00

  Commands leading to the command that caused the error were:
  CR FEATR COUNT  LBA_48  LH LM LL DV DC  Powered_Up_Time  Command/Feature_Name
  -- == -- == -- == == == -- -- -- -- --  ---------------  --------------------
  ea 00 00 00 00 00 00 00 00 00 00 e0 08 28d+02:36:05.690  FLUSH CACHE EXT
  35 00 00 00 08 00 00 59 c8 b3 b0 e0 08 28d+02:36:05.489  WRITE DMA EXT
  35 00 00 00 08 00 00 59 c8 4c 38 e0 08 28d+02:36:05.488  WRITE DMA EXT
  35 00 00 00 08 00 00 59 c8 3d a8 e0 08 28d+02:36:05.488  WRITE DMA EXT
  35 00 00 00 08 00 00 59 c8 1e 28 e0 08 28d+02:36:05.488  WRITE DMA EXT

Error 26 [1] occurred at disk power-on lifetime: 17399 hours (724 days + 23 hours)
  When the command that caused the error occurred, the device was active or idle.

  After command completion occurred, registers were:
  ER -- ST COUNT  LBA_48  LH LM LL DV DC
  -- -- -- == -- == == == -- -- -- -- --
  04 -- 51 00 00 00 00 00 f7 df 38 a7 00

  Commands leading to the command that caused the error were:
  CR FEATR COUNT  LBA_48  LH LM LL DV DC  Powered_Up_Time  Command/Feature_Name
  -- == -- == -- == == == -- -- -- -- --  ---------------  --------------------
  ea 00 00 00 00 00 00 00 00 00 00 e0 08 28d+01:41:22.424  FLUSH CACHE EXT
  35 00 00 00 08 00 00 59 87 69 c0 e0 08 28d+01:41:22.424  WRITE DMA EXT
  35 00 00 00 08 00 00 47 07 6c 28 e0 08 28d+01:41:22.402  WRITE DMA EXT
  ca 00 00 00 18 00 00 01 07 69 a0 e1 08 28d+01:41:22.391  WRITE DMA
  ca 00 00 00 28 00 00 01 07 69 68 e1 08 28d+01:41:22.388  WRITE DMA

Error 25 [0] occurred at disk power-on lifetime: 17398 hours (724 days + 22 hours)
  When the command that caused the error occurred, the device was active or idle.

  After command completion occurred, registers were:
  ER -- ST COUNT  LBA_48  LH LM LL DV DC
  -- -- -- == -- == == == -- -- -- -- --
  04 -- 51 00 00 00 00 00 f7 df 38 a7 00

  Commands leading to the command that caused the error were:
  CR FEATR COUNT  LBA_48  LH LM LL DV DC  Powered_Up_Time  Command/Feature_Name
  -- == -- == -- == == == -- -- -- -- --  ---------------  --------------------
  ea 00 00 00 00 00 00 00 00 00 00 e0 08 27d+23:59:37.728  FLUSH CACHE EXT
  35 00 00 00 08 00 00 59 8a 94 98 e0 08 27d+23:59:37.728  WRITE DMA EXT
  35 00 00 00 08 00 00 59 8a 94 78 e0 08 27d+23:59:36.562  WRITE DMA EXT
  35 00 00 00 08 00 00 59 8a 89 40 e0 08 27d+23:59:36.562  WRITE DMA EXT
  35 00 00 00 08 00 00 59 8a 87 40 e0 08 27d+23:59:36.562  WRITE DMA EXT

Error 24 [23] occurred at disk power-on lifetime: 17397 hours (724 days + 21 hours)
  When the command that caused the error occurred, the device was active or idle.

  After command completion occurred, registers were:
  ER -- ST COUNT  LBA_48  LH LM LL DV DC
  -- -- -- == -- == == == -- -- -- -- --
  04 -- 51 00 00 00 00 00 f7 df 38 a7 00

  Commands leading to the command that caused the error were:
  CR FEATR COUNT  LBA_48  LH LM LL DV DC  Powered_Up_Time  Command/Feature_Name
  -- == -- == -- == == == -- -- -- -- --  ---------------  --------------------
  ea 00 00 00 00 00 00 00 00 00 00 e0 08 27d+23:54:15.892  FLUSH CACHE EXT
  35 00 00 00 08 00 00 6b 47 9a e8 e0 08 27d+23:54:15.692  WRITE DMA EXT
  35 00 00 00 08 00 00 6b 47 8c b0 e0 08 27d+23:54:15.692  WRITE DMA EXT
  35 00 00 00 08 00 00 6b 47 7f 28 e0 08 27d+23:54:15.692  WRITE DMA EXT
  35 00 00 00 08 00 00 6b 47 79 68 e0 08 27d+23:54:15.692  WRITE DMA EXT

Error 23 [22] occurred at disk power-on lifetime: 17395 hours (724 days + 19 hours)
  When the command that caused the error occurred, the device was active or idle.

  After command completion occurred, registers were:
  ER -- ST COUNT  LBA_48  LH LM LL DV DC
  -- -- -- == -- == == == -- -- -- -- --
  04 -- 51 00 00 00 00 00 f7 df 38 a7 00

  Commands leading to the command that caused the error were:
  CR FEATR COUNT  LBA_48  LH LM LL DV DC  Powered_Up_Time  Command/Feature_Name
  -- == -- == -- == == == -- -- -- -- --  ---------------  --------------------
  ea 00 00 00 00 00 00 00 00 00 00 e0 08 27d+21:42:09.389  FLUSH CACHE EXT
  35 00 00 00 08 00 00 62 c7 6d 58 e0 08 27d+21:42:09.188  WRITE DMA EXT
  35 00 00 00 08 00 00 62 c7 68 08 e0 08 27d+21:42:09.188  WRITE DMA EXT
  35 00 00 00 08 00 00 61 07 9e f0 e0 08 27d+21:42:09.188  WRITE DMA EXT
  35 00 00 00 08 00 00 61 07 88 70 e0 08 27d+21:42:09.188  WRITE DMA EXT

SMART Extended Self-test Log Version: 1 (1 sectors)
Num  Test_Description    Status                  Remaining  LifeTime(hours)  LBA_of_first_error
# 1  Short offline       Completed without error       00%     17586         -
# 2  Short offline       Completed without error       00%     17558         -

SMART Selective self-test log data structure revision number 1
 SPAN  MIN_LBA  MAX_LBA  CURRENT_TEST_STATUS
    1        0        0  Not_testing
    2        0        0  Not_testing
    3        0        0  Not_testing
    4        0        0  Not_testing
    5        0        0  Not_testing
Selective self-test flags (0x0):
  After scanning selected spans, do NOT read-scan remainder of disk.
If Selective self-test is pending on power-up, resume after 0 minute delay.

SCT Status Version:                  3
SCT Version (vendor specific):       258 (0x0102)
Device State:                        Active (0)
Current Temperature:                    23 Celsius
Power Cycle Min/Max Temperature:     23/23 Celsius
Lifetime    Min/Max Temperature:      0/43 Celsius
Under/Over Temperature Limit Count:   0/0

SCT Temperature History Version:     2
Temperature Sampling Period:         1 minute
Temperature Logging Interval:        1 minute
Min/Max recommended Temperature:      0/60 Celsius
Min/Max Temperature Limit:           -41/85 Celsius
Temperature History Size (Index):    478 (409)

Index    Estimated Time   Temperature Celsius
 410    2019-12-03 08:08    35  ****************
 ...    ..(289 skipped).    ..  ****************
 222    2019-12-03 12:58    35  ****************
 223    2019-12-03 12:59     ?  -
 224    2019-12-03 13:00    34  ***************
 ...    ..(  7 skipped).    ..  ***************
 232    2019-12-03 13:08    34  ***************
 233    2019-12-03 13:09     ?  -
 234    2019-12-03 13:10    22  ***
 235    2019-12-03 13:11    22  ***
 236    2019-12-03 13:12    24  *****
 237    2019-12-03 13:13     ?  -
 238    2019-12-03 13:14    21  **
 239    2019-12-03 13:15     ?  -
 240    2019-12-03 13:16    22  ***
 241    2019-12-03 13:17     ?  -
 242    2019-12-03 13:18    22  ***
 243    2019-12-03 13:19     ?  -
 244    2019-12-03 13:20    21  **
 245    2019-12-03 13:21    21  **
 246    2019-12-03 13:22    22  ***
 247    2019-12-03 13:23     ?  -
 248    2019-12-03 13:24    24  *****
 249    2019-12-03 13:25    24  *****
 250    2019-12-03 13:26     ?  -
 251    2019-12-03 13:27    23  ****
 252    2019-12-03 13:28     ?  -
 253    2019-12-03 13:29    23  ****
 254    2019-12-03 13:30    35  ****************
 ...    ..(154 skipped).    ..  ****************
 409    2019-12-03 16:05    35  ****************

SCT Error Recovery Control:
           Read:     70 (7.0 seconds)
          Write:     70 (7.0 seconds)

Device Statistics (GP/SMART Log 0x04) not supported

Pending Defects log (GP Log 0x0c) not supported

SATA Phy Event Counters (GP Log 0x11)
ID      Size     Value  Description
0x0001  2            0  Command failed due to ICRC error
0x0002  2            0  R_ERR response for data FIS
0x0003  2            0  R_ERR response for device-to-host data FIS
0x0004  2            0  R_ERR response for host-to-device data FIS
0x0005  2            0  R_ERR response for non-data FIS
0x0006  2            0  R_ERR response for device-to-host non-data FIS
0x0007  2            0  R_ERR response for host-to-device non-data FIS
0x0008  2            0  Device-to-host non-data FIS retries
0x0009  2            1  Transition from drive PhyRdy to drive PhyNRdy
0x000a  2            1  Device-to-host register FISes sent due to a COMRESET
0x000b  2            0  CRC errors within host-to-device FIS
0x000f  2            0  R_ERR response for host-to-device data FIS, CRC
0x0012  2            0  R_ERR response for host-to-device non-data FIS, CRC
0x8000  4            5  Vendor specific

