smartctl 7.0 2019-03-31 r4903 [x86_64-linux-5.3.12-200.fc30.x86_64] (local build)
Copyright (C) 2002-18, Bruce Allen, Christian Franke, www.smartmontools.org

=== START OF INFORMATION SECTION ===
Model Family:     Hitachi Deskstar 7K1000.C
Device Model:     Hitachi HDS721010CLA332
Serial Number:    LINUXFABRIK4ZF
LU WWN Device Id: 5 000cca 375ca4bd8
Firmware Version: JP4OA3MA
User Capacity:    1’000’204’886’016 bytes [1.00 TB]
Sector Size:      512 bytes logical/physical
Rotation Rate:    7200 rpm
Form Factor:      3.5 inches
Device is:        In smartctl database [for details use: -P show]
ATA Version is:   ATA8-ACS T13/1699-D revision 4
SATA Version is:  SATA 2.6, 3.0 Gb/s
Local Time is:    Tue Dec  3 16:04:28 2019 CET
SMART support is: Available - device has SMART capability.
SMART support is: Enabled
AAM feature is:   Unavailable
APM feature is:   Disabled
Rd look-ahead is: Enabled
Write cache is:   Enabled
DSN feature is:   Unavailable
ATA Security is:  Disabled, NOT FROZEN [SEC1]
Wt Cache Reorder: Enabled

=== START OF READ SMART DATA SECTION ===
SMART overall-health self-assessment test result: PASSED

General SMART Values:
Offline data collection status:  (0x80)	Offline data collection activity
					was never started.
					Auto Offline Data Collection: Enabled.
Self-test execution status:      (   0)	The previous self-test routine completed
					without error or no self-test has ever 
					been run.
Total time to complete Offline 
data collection: 		( 9812) seconds.
Offline data collection
capabilities: 			 (0x5b) SMART execute Offline immediate.
					Auto Offline data collection on/off support.
					Suspend Offline collection upon new
					command.
					Offline surface scan supported.
					Self-test supported.
					No Conveyance Self-test supported.
					Selective Self-test supported.
SMART capabilities:            (0x0003)	Saves SMART data before entering
					power-saving mode.
					Supports SMART auto save timer.
Error logging capability:        (0x01)	Error logging supported.
					General Purpose Logging supported.
Short self-test routine 
recommended polling time: 	 (   1) minutes.
Extended self-test routine
recommended polling time: 	 ( 164) minutes.
SCT capabilities: 	       (0x003d)	SCT Status supported.
					SCT Error Recovery Control supported.
					SCT Feature Control supported.
					SCT Data Table supported.

SMART Attributes Data Structure revision number: 16
Vendor Specific SMART Attributes with Thresholds:
ID# ATTRIBUTE_NAME          FLAGS    VALUE WORST THRESH FAIL RAW_VALUE
  1 Raw_Read_Error_Rate     PO-R--   100   100   016    -    0
  2 Throughput_Performance  P-S---   136   136   054    -    95
  3 Spin_Up_Time            POS---   141   141   024    -    317 (Average 219)
  4 Start_Stop_Count        -O--C-   100   100   000    -    77
  5 Reallocated_Sector_Ct   PO--CK   100   100   005    -    0
  7 Seek_Error_Rate         PO-R--   100   100   067    -    0
  8 Seek_Time_Performance   P-S---   140   140   020    -    30
  9 Power_On_Hours          -O--C-   093   093   000    -    49177
 10 Spin_Retry_Count        PO--C-   100   100   060    -    0
 12 Power_Cycle_Count       -O--CK   100   100   000    -    73
192 Power-Off_Retract_Count -O--CK   100   100   000    -    148
193 Load_Cycle_Count        -O--C-   100   100   000    -    148
194 Temperature_Celsius     -O----   253   253   000    -    23 (Min/Max 19/51)
196 Reallocated_Event_Count -O--CK   100   100   000    -    0
197 Current_Pending_Sector  -O---K   100   100   000    -    0
198 Offline_Uncorrectable   ---R--   100   100   000    -    0
199 UDMA_CRC_Error_Count    -O-R--   200   200   000    -    0
                            ||||||_ K auto-keep
                            |||||__ C event count
                            ||||___ R error rate
                            |||____ S speed/performance
                            ||_____ O updated online
                            |______ P prefailure warning

General Purpose Log Directory Version 1
SMART           Log Directory Version 1 [multi-sector log support]
Address    Access  R/W   Size  Description
0x00       GPL,SL  R/O      1  Log Directory
0x01           SL  R/O      1  Summary SMART error log
0x03       GPL     R/O      1  Ext. Comprehensive SMART error log
0x04       GPL     R/O      7  Device Statistics log
0x06           SL  R/O      1  SMART self-test log
0x07       GPL     R/O      1  Extended self-test log
0x09           SL  R/W      1  Selective self-test log
0x10       GPL     R/O      1  NCQ Command Error log
0x11       GPL     R/O      1  SATA Phy Event Counters log
0x20       GPL     R/O      1  Streaming performance log [OBS-8]
0x21       GPL     R/O      1  Write stream error log
0x22       GPL     R/O      1  Read stream error log
0x80-0x9f  GPL,SL  R/W     16  Host vendor specific log
0xe0       GPL,SL  R/W      1  SCT Command/Status
0xe1       GPL,SL  R/W      1  SCT Data Transfer

SMART Extended Comprehensive Error Log Version: 0 (1 sectors)
No Errors Logged

SMART Extended Self-test Log Version: 1 (1 sectors)
Num  Test_Description    Status                  Remaining  LifeTime(hours)  LBA_of_first_error
# 1  Extended offline    Aborted by host               90%     49094         -
# 2  Short offline       Completed without error       00%     49094         -
# 3  Short offline       Completed without error       00%     48967         -

SMART Selective self-test log data structure revision number 1
 SPAN  MIN_LBA  MAX_LBA  CURRENT_TEST_STATUS
    1        0        0  Not_testing
    2        0        0  Not_testing
    3        0        0  Not_testing
    4        0        0  Not_testing
    5        0        0  Not_testing
Selective self-test flags (0x0):
  After scanning selected spans, do NOT read-scan remainder of disk.
If Selective self-test is pending on power-up, resume after 0 minute delay.

SCT Status Version:                  3
SCT Version (vendor specific):       256 (0x0100)
Device State:                        Active (0)
Current Temperature:                    23 Celsius
Power Cycle Min/Max Temperature:     23/23 Celsius
Lifetime    Min/Max Temperature:     19/51 Celsius
Under/Over Temperature Limit Count:   0/0

SCT Temperature History Version:     2
Temperature Sampling Period:         1 minute
Temperature Logging Interval:        1 minute
Min/Max recommended Temperature:      0/60 Celsius
Min/Max Temperature Limit:           -40/70 Celsius
Temperature History Size (Index):    128 (65)

Index    Estimated Time   Temperature Celsius
  66    2019-12-03 13:57    39  ********************
 ...    ..( 13 skipped).    ..  ********************
  80    2019-12-03 14:11    39  ********************
  81    2019-12-03 14:12    40  *********************
  82    2019-12-03 14:13    39  ********************
  83    2019-12-03 14:14    39  ********************
  84    2019-12-03 14:15    40  *********************
 ...    ..( 91 skipped).    ..  *********************
  48    2019-12-03 15:47    40  *********************
  49    2019-12-03 15:48     ?  -
 ...    ..(  4 skipped).    ..  -
  54    2019-12-03 15:53     ?  -
  55    2019-12-03 15:54    24  *****
  56    2019-12-03 15:55    25  ******
  57    2019-12-03 15:56    25  ******
  58    2019-12-03 15:57    26  *******
  59    2019-12-03 15:58    26  *******
  60    2019-12-03 15:59    27  ********
  61    2019-12-03 16:00    27  ********
  62    2019-12-03 16:01    27  ********
  63    2019-12-03 16:02    28  *********
  64    2019-12-03 16:03    28  *********
  65    2019-12-03 16:04     ?  -

SCT Error Recovery Control:
           Read: Disabled
          Write: Disabled

Device Statistics (GP Log 0x04)
Page  Offset Size        Value Flags Description
0x01  =====  =               =  ===  == General Statistics (rev 1) ==
0x01  0x008  4              73  ---  Lifetime Power-On Resets
0x01  0x010  4           49177  ---  Power-on Hours
0x01  0x018  6    258363510428  ---  Logical Sectors Written
0x01  0x020  6      3961793441  ---  Number of Write Commands
0x01  0x028  6    534518016203  ---  Logical Sectors Read
0x01  0x030  6      3745855078  ---  Number of Read Commands
0x03  =====  =               =  ===  == Rotating Media Statistics (rev 1) ==
0x03  0x008  4           49112  ---  Spindle Motor Power-on Hours
0x03  0x010  4           49112  ---  Head Flying Hours
0x03  0x018  4             148  ---  Head Load Events
0x03  0x020  4               0  ---  Number of Reallocated Logical Sectors
0x03  0x028  4             372  ---  Read Recovery Attempts
0x03  0x030  4               2  ---  Number of Mechanical Start Failures
0x04  =====  =               =  ===  == General Errors Statistics (rev 1) ==
0x04  0x008  4               0  ---  Number of Reported Uncorrectable Errors
0x04  0x010  4             199  ---  Resets Between Cmd Acceptance and Completion
0x05  =====  =               =  ===  == Temperature Statistics (rev 1) ==
0x05  0x008  1              23  ---  Current Temperature
0x05  0x010  1              31  N--  Average Short Term Temperature
0x05  0x018  1              33  N--  Average Long Term Temperature
0x05  0x020  1              51  ---  Highest Temperature
0x05  0x028  1              19  ---  Lowest Temperature
0x05  0x030  1              42  N--  Highest Average Short Term Temperature
0x05  0x038  1               0  N--  Lowest Average Short Term Temperature
0x05  0x040  1              34  N--  Highest Average Long Term Temperature
0x05  0x048  1               0  N--  Lowest Average Long Term Temperature
0x05  0x050  4               0  ---  Time in Over-Temperature
0x05  0x058  1              60  ---  Specified Maximum Operating Temperature
0x05  0x060  4               0  ---  Time in Under-Temperature
0x05  0x068  1               0  ---  Specified Minimum Operating Temperature
0x06  =====  =               =  ===  == Transport Statistics (rev 1) ==
0x06  0x008  4            5352  ---  Number of Hardware Resets
0x06  0x010  4             252  ---  Number of ASR Events
0x06  0x018  4               0  ---  Number of Interface CRC Errors
                                |||_ C monitored condition met
                                ||__ D supports DSN
                                |___ N normalized value

Pending Defects log (GP Log 0x0c) not supported

SATA Phy Event Counters (GP Log 0x11)
ID      Size     Value  Description
0x0001  2            0  Command failed due to ICRC error
0x0002  2            0  R_ERR response for data FIS
0x0005  2            0  R_ERR response for non-data FIS
0x0009  2            1  Transition from drive PhyRdy to drive PhyNRdy
0x000a  2            0  Device-to-host register FISes sent due to a COMRESET
0x000b  2            0  CRC errors within host-to-device FIS
0x000d  2            0  Non-CRC errors within host-to-device FIS

